{
  "schemaVersion": "1.0.0",
  "gameId": "grave-threat",
  "displayName": "Grave Threat",
  "iframeSelectorKey": "gameIframe",
  "controllers": [
    {
      "id": "scratchCard",
      "enabled": true
    }
  ],
  "locatorKeys": {
    "gameGrid": "div.grid",
    "gameIframe": "iframe[title=\"Game session\"]",
    "searchGames": "input[placeholder*=\"Search games\"]"
  },
  "canvasActions": {
    "canvasSelector": "canvas",
    "actions": {
      "scratchCard": {
        "x": 0.222,
        "y": 0.733
      }
    }
  },
  "scratchCard": {
    "hubUrlPattern": "**/hubs/game",
    "sideCanvasSelector": "#scratch-side-host canvas",
    "inCanvasDrawer": {
      "x": 0,
      "y": 0.0713,
      "width": 1,
      "height": 0.9287
    },
    "actions": {
      "size3x3": {
        "x": 0.266,
        "y": 0.203
      },
      "size4x4": {
        "x": 0.5,
        "y": 0.203
      },
      "size5x5": {
        "x": 0.735,
        "y": 0.203
      },
      "buyCard": {
        "x": 0.5,
        "y": 0.941
      },
      "scratchAll": {
        "x": 0.5,
        "y": 0.941
      },
      "close": {
        "x": 0.925,
        "y": 0.047
      },
      "betMinus": {
        "x": 0.151,
        "y": 0.85
      },
      "betPlus": {
        "x": 0.852,
        "y": 0.85
      }
    },
    "scratchArea": {
      "x": 0.08,
      "y": 0.31,
      "width": 0.84,
      "height": 0.47
    },
    "openProbe": {
      "area": {
        "x": 0.12,
        "y": 0.92,
        "width": 0.18,
        "height": 0.04
      },
      "hue": "green",
      "minShare": 0.6
    },
    "textAreas": {
      "title": {
        "x": 0.03,
        "y": 0.01,
        "width": 0.6,
        "height": 0.07
      },
      "totalWin": {
        "x": 0.2,
        "y": 0.06,
        "width": 0.6,
        "height": 0.055
      },
      "sizeTabs": {
        "x": 0.1,
        "y": 0.175,
        "width": 0.8,
        "height": 0.05
      },
      "legend": {
        "x": 0.05,
        "y": 0.275,
        "width": 0.9,
        "height": 0.04
      },
      "betValue": {
        "x": 0.3,
        "y": 0.835,
        "width": 0.4,
        "height": 0.035
      },
      "pill": {
        "x": 0.2,
        "y": 0.905,
        "width": 0.6,
        "height": 0.05
      }
    }
  },
  "network": {
    "betUrlPattern": "**/api/v1/slots/bet",
    "initializeUrlPattern": "**/api/v1/slots/initialize",
    "fields": {
      "balance": "balance",
      "totalWin": "slot.totalWin",
      "transactionState": "transactionState"
    }
  },
  "metadata": {
    "launcherGameLabel": "Grave Threat",
    "launcherGameId": "00090725",
    "launcherGameKey": "grave_threat",
    "playButtonAriaLabel": "Play in modal",
    "rendering": "canvas",
    "host": "dijoker",
    "devices": "mobile,desktop",
    "portraitViewport": "390x844",
    "orientationLock": "portrait",
    "stagingStatus": "active",
    "notes": "Scratch-only manifest (SCG). Game space 428x926; HUD SCRATCH button from Phaser discovery; scratch drawer is the shared 428x860 panel. Slot controllers (spin, bet, buy…) are not configured for this title.",
    "packageId": "package-5",
    "normalModeMultiplier": "true"
  }
}
