{
  "schemaVersion": "1.0.0",
  "gameId": "mars-triumph",
  "displayName": "Mars Triumph",
  "iframeSelectorKey": "gameIframe",
  "controllers": [
    {
      "id": "spin",
      "enabled": true
    },
    {
      "id": "autoplay",
      "enabled": true
    },
    {
      "id": "buyFeature",
      "enabled": true
    },
    {
      "id": "bet",
      "enabled": true
    },
    {
      "id": "amplifyBet",
      "enabled": true
    },
    {
      "id": "turbo",
      "enabled": true
    },
    {
      "id": "menu",
      "enabled": true
    },
    {
      "id": "settings",
      "enabled": true
    },
    {
      "id": "fullscreen",
      "enabled": true
    },
    {
      "id": "scratchCard",
      "enabled": true
    }
  ],
  "locatorKeys": {
    "gameGrid": "div.grid",
    "gameIframe": "iframe[title=\"Game session\"]",
    "searchGames": "input[placeholder*=\"Search games\"]"
  },
  "canvasActions": {
    "canvasSelector": "canvas",
    "actions": {
      "enter": {
        "x": 0.5,
        "y": 0.68
      },
      "enterMid": {
        "x": 0.5,
        "y": 0.74
      },
      "enterLow": {
        "x": 0.5,
        "y": 0.82
      },
      "acknowledge": {
        "x": 0.5,
        "y": 0.56
      },
      "acknowledgeAlt": {
        "x": 0.5,
        "y": 0.6
      },
      "dismiss": {
        "x": 0.5,
        "y": 0.5
      },
      "closeOverlay": {
        "x": 0.88,
        "y": 0.22
      },
      "spin": {
        "x": 0.518,
        "y": 0.879
      },
      "buyFeature": {
        "x": 0.513,
        "y": 0.795
      },
      "buyFeatureConfirm": {
        "x": 0.5,
        "y": 0.82
      },
      "buyFeatureConfirmAlt": {
        "x": 0.5,
        "y": 0.84
      },
      "buyFeatureCancel": {
        "x": 0.921,
        "y": 0.248
      },
      "betMinus": {
        "x": 0.719,
        "y": 0.796
      },
      "betPlus": {
        "x": 0.905,
        "y": 0.796
      },
      "turbo": {
        "x": 0.898,
        "y": 0.884
      },
      "amplifyBet": {
        "x": 0.736,
        "y": 0.879
      },
      "menu": {
        "x": 0.138,
        "y": 0.884
      },
      "menuClose": {
        "x": 0.86,
        "y": 0.08
      },
      "menuCloseAlt": {
        "x": 0.84,
        "y": 0.1
      },
      "settingsTab": {
        "x": 0.72,
        "y": 0.12
      },
      "fullscreen": {
        "x": 0.95,
        "y": 0.06
      },
      "autoplay": {
        "x": 0.299,
        "y": 0.879
      },
      "autoplayConfirm": {
        "x": 0.42,
        "y": 0.78
      },
      "autoplayStart": {
        "x": 0.5,
        "y": 0.82
      },
      "autoplayStartAlt": {
        "x": 0.5,
        "y": 0.84
      },
      "autoplayStop": {
        "x": 0.299,
        "y": 0.879
      },
      "autoplaySpins10": {
        "x": 0.22,
        "y": 0.52
      },
      "scratchCard": {
        "x": 0.222,
        "y": 0.733
      }
    }
  },
  "scratchCard": {
    "hubUrlPattern": "**/hubs/game",
    "sideCanvasSelector": "#scratch-side-host canvas",
    "inCanvasDrawer": {
      "x": 0,
      "y": 0.0713,
      "width": 1,
      "height": 0.9287
    },
    "actions": {
      "size3x3": {
        "x": 0.266,
        "y": 0.203
      },
      "size4x4": {
        "x": 0.5,
        "y": 0.203
      },
      "size5x5": {
        "x": 0.735,
        "y": 0.203
      },
      "buyCard": {
        "x": 0.5,
        "y": 0.941
      },
      "scratchAll": {
        "x": 0.5,
        "y": 0.941
      },
      "close": {
        "x": 0.925,
        "y": 0.047
      },
      "betMinus": {
        "x": 0.151,
        "y": 0.85
      },
      "betPlus": {
        "x": 0.852,
        "y": 0.85
      }
    },
    "scratchArea": {
      "x": 0.08,
      "y": 0.31,
      "width": 0.84,
      "height": 0.47
    },
    "openProbe": {
      "area": {
        "x": 0.12,
        "y": 0.92,
        "width": 0.18,
        "height": 0.04
      },
      "hue": "green",
      "minShare": 0.6
    },
    "textAreas": {
      "title": {
        "x": 0.03,
        "y": 0.01,
        "width": 0.6,
        "height": 0.07
      },
      "totalWin": {
        "x": 0.2,
        "y": 0.06,
        "width": 0.6,
        "height": 0.055
      },
      "sizeTabs": {
        "x": 0.1,
        "y": 0.175,
        "width": 0.8,
        "height": 0.05
      },
      "legend": {
        "x": 0.05,
        "y": 0.275,
        "width": 0.9,
        "height": 0.04
      },
      "betValue": {
        "x": 0.3,
        "y": 0.835,
        "width": 0.4,
        "height": 0.035
      },
      "pill": {
        "x": 0.2,
        "y": 0.905,
        "width": 0.6,
        "height": 0.05
      }
    }
  },
  "network": {
    "betUrlPattern": "**/api/v1/slots/bet",
    "initializeUrlPattern": "**/api/v1/slots/initialize",
    "fields": {
      "balance": "balance",
      "totalWin": "slot.totalWin",
      "transactionState": "transactionState",
      "baseWin": "slot.base.win",
      "bonusWin": "slot.bonus.win"
    }
  },
  "reelValidation": {
    "symbolTemplateDir": "config/symbols/mars-triumph",
    "reelRegion": {
      "x": 0.03,
      "y": 0.28,
      "width": 0.94,
      "height": 0.36
    },
    "cellInset": 0.16,
    "matchThreshold": 0.4,
    "helpOpenActions": ["menu"],
    "helpCloseActions": ["menuClose", "menuCloseAlt"]
  },
  "metadata": {
    "launcherGameLabel": "Mars Triumph",
    "launcherGameId": "00220126",
    "launcherGameKey": "mars_triumph",
    "packageId": "package-1",
    "normalModeMultiplier": "false",
    "playButtonAriaLabel": "Play in modal",
    "rendering": "canvas",
    "host": "dijoker",
    "devices": "mobile,desktop",
    "portraitViewport": "390x844",
    "preSpinActions": "enter,enterMid,enterLow,acknowledge,acknowledgeAlt",
    "betStep": "0.2",
    "autoplayNeedsConfirm": "true",
    "autoplaySpinCountAction": "autoplaySpins10",
    "autoplaySelectedSpins": "10",
    "buyFeatureNeedsConfirm": "true",
    "stagingStatus": "active",
    "notes": "Same package wave-0; splash enter probes 0.72/0.76/0.82."
  }
}
